{
  "$comment": "KURGUSAL ORNEK. Iki yonlu celiski ornegi. Metin ve kaynaklar uydurmadir.",
  "id": "CLM-003",
  "text": "Kurgusal ornek: bir calisma etkiyi bulurken baska bir calisma bulamamistir.",
  "importance": "high",
  "sources": ["SRC-001", "SRC-006"],
  "evidence_ids": ["EVD-001", "EVD-002"],
  "contradicted_by": ["CLM-004"],
  "gap_ids": ["GAP-001"],
  "verification_status": "refuted",
  "confidence_level": 0.4,
  "evidence_type": "empirical",
  "notes": "Celiski cozulmedi; tartisma bolumune aktarilmali.",
  "chapter_id": null,
  "section_id": null,
  "created_at": "2026-09-26T10:35:00+00:00",
  "last_verified_at": "2026-09-26T10:35:00+00:00",
  "verified_by": null,
  "related_claims": ["CLM-004"],
  "counter_claims": ["CLM-004"],
  "requires_followup": true
}
